日米修好通商条約,江戸,1858年に日本とアメリカとの間で締結された、不平等な通商条約は何ですか？,日米和親条約 日英通商航海条約 日露通商条約 日独通商条約 日仏通商条約 日韓条約 日中条約 日蘭通商条約 日墨修好条約 日墺通商条約
日米和親条約,江戸,1854年に日本が開国する契機となったアメリカとの条約は何ですか？,日米修好通商条約 日英同盟 日露講和条約 日独通商条約 日仏同盟 日韓条約 日中友好条約 日蘭通商条約 日墨修好条約 日墺通商条約
日明貿易(勘合貿易),室町,足利義満が始めた、明との正式な貿易で勘合を用いた貿易は何ですか？,日宋貿易 日朝貿易 日露貿易 日米貿易 日英貿易 日独貿易 日仏貿易 日韓貿易 日蘭貿易 日清貿易
日蓮宗(法華宗),鎌倉,「南無妙法蓮華経」を唱えることを中心とし、日蓮によって開かれた宗派は何ですか？,浄土宗 禅宗 真言宗 天台宗 浄土真宗 曹洞宗 臨済宗 日蓮正宗 神道 修験道
日露戦争,明治,1904年に日本とロシアとの間で起こった戦争は何ですか？,日清戦争 日英戦争 日米戦争 日韓戦争 第一次世界大戦 第二次世界大戦 日独戦争 日仏戦争 日蘭戦争 日中戦争
日韓基本条約,昭和,1965年に日本と大韓民国の国交正常化を実現した条約は何ですか？,日中基本条約 日露基本条約 日米基本条約 日ソ基本条約 日英基本条約 日仏基本条約 日豪基本条約 日独基本条約 日加基本条約 日墨基本条約
日清修好条規,明治,1871年に日本と清国の間で結ばれた最初の対等な条約は何ですか？,天津条約 北京条約 南京条約 上海条約 広州条約 馬関条約 下関条約 日露修好条規 日英修好条規 日米修好条約
日清戦争,明治,1894年に朝鮮の支配をめぐって日本と清国の間で起きた戦争は何ですか？,日露戦争 日英戦争 第三次世界大戦 第一次世界大戦 第二次世界大戦 日独戦争 日仏戦争 日蘭戦争 日韓戦争 日米戦争
日宋貿易(宋との貿易),平安〜鎌倉,平清盛が積極的に行った中国との貿易を何と言いますか？,日明貿易 日朝貿易 日露貿易 日米貿易 日英貿易 日仏貿易 日蘭貿易 日韓貿易 日独貿易 日墨貿易
日ソ共同宣言,昭和,1956年に日本とソ連の国交を回復させた文書は何ですか？,日中共同宣言 日米安全保障条約 日英同盟 日露講和条約 日韓基本条約 日独同盟 日仏友好条約 日蘭条約 日米修好通商条約 日露条約
日ソ中立条約,昭和,1941年に日本とソ連が互いに攻撃しないことを約束した条約は何ですか？,日中中立条約 日米中立条約 日英中立条約 日独中立条約 日韓中立条約 日仏中立条約 日蘭中立条約 日墨中立条約 日露不侵略条約 日米不戦協定
日中共同声明,昭和,1972年に日本と中国が国交を正常化したことを発表した文書は何ですか？,日中平和条約 日中友好条約 日中安保条約 日中協力協定 日中経済協定 日中文化交流協定 日中通商協定 日中安全保障条約 日中経済連携協定 日中軍事協定
日中戦争(支那事変),昭和,1937年に盧溝橋事件をきっかけに始まった日本と中国の戦争は何ですか？,日露戦争 日清戦争 第一次世界大戦 第二次世界大戦 日米戦争 日韓戦争 日独戦争 日英戦争 日仏戦争 日蘭戦争
日中平和友好条約,昭和,1978年に日本と中国の間で締結された平和的関係を確認する条約は何ですか？,日中基本条約 日中友好協定 日中安全保障条約 日中経済協力協定 日中文化交流条約 日中軍事協定 日中通商条約 日中同盟 日中協力条約 日中相互防衛条約
日朝修好条規,明治,1876年に日本と朝鮮の間で結ばれた、朝鮮にとって初の近代的条約は何ですか？,日韓条約 日中修好条規 日露修好条規 日英修好条約 日米修好条約 日仏修好条約 日蘭修好条約 日墨修好条約 日独修好条約 日豪修好条約
日本社会党,昭和,戦後に結成され、平和主義・社会主義を掲げて活動した政党は何ですか？,自由民主党 日本共産党 公明党 民社党 社会民主党 民主党 日本維新の会 国民民主党 立憲民主党 日本未来の党
二・二六事件,昭和,1936年に陸軍の青年将校が起こしたクーデター未遂事件は何ですか？,五・一五事件 三・一五事件 四・一六事件 三・二六事件 二・二五事件 一・二六事件 六・一五事件 七・一五事件 八・二六事件 九・一五事件
日本(国号),古墳,7世紀に「倭」から改められ、公式に使用されるようになった国号は何ですか？,倭 大和 唐 新羅 百済 高句麗 魏 晋 秦 漢
日本海海戦,明治,日露戦争で日本海軍がバルチック艦隊を破った戦いは何ですか？,黄海海戦 対馬海戦 関門海戦 津軽海戦 釜山海戦 広島海戦 長崎海戦 神戸海戦 大阪海戦 東京海戦
日本共産党,大正,1922年に結成され、戦後には合法政党として活動を続ける左派政党は何ですか？,日本社会党 自由党 民社党 公明党 民主党 社会民主党 日本維新の会 国民民主党 立憲民主党 希望の党
日本銀行,明治,1882年に設立され、日本の中央銀行として金融政策を担っている機関は何ですか？,財務省 日銀券 東京銀行 大阪銀行 第一銀行 第二銀行 農林中央金庫 証券取引所 証券会社 中央会計局
日本国憲法,昭和,1947年に施行された、日本の現行憲法は何ですか？,明治憲法 大日本帝国憲法 国際憲章 憲法改正案 大正憲法 昭和憲法 平和憲法 自衛隊憲法 統治憲法 緊急事態条項
日本書紀,奈良,日本最初の正史である、720年に完成した歴史書は何ですか？,古事記 風土記 万葉集 続日本紀 日本後紀 続紀 日本霊異記 日本外史 日本武尊伝 日本伝記
日本農民組合,大正,1922年に結成された、日本初の全国的な農民運動組織は何ですか？,農業協同組合 全日本農民組合 農業共済組合 農村青年会 全国農協連 農業青年連盟 日本青年農業会 農業改良普及協会 農政会 農村振興協会
日本町,戦国〜江戸,東南アジアに進出した日本人が形成した居留地を何と言いますか？,唐人町 朝鮮町 インド人街 清人町 オランダ町 ポルトガル町 イギリス町 フランス町 スペイン町 マレー町
日本労働総同盟,大正,大正期に設立され、戦前最大の労働団体となった組織は何ですか？,日本労働組合総連合会 日本労働組合協議会 日本労働組合会 日本労働者連盟 日本労働者協会 日本産業別労働組合 日本労働者連合 日本労働連盟 日本労働組合連合 日本労働会議所
二毛作,鎌倉,鎌倉時代に畿内や西日本で、稲作と麦作を組み合わせて行うようになった農業技術は何ですか？,単作 三毛作 輪作 連作 抑作 複作 複稲作 多毛作 雑作 畑作
二毛作,南北朝,南北朝時代に関東地方に広まった農業技術を何と言いますか？,単作 三毛作 輪作 連作 抑作 複作 複稲作 多毛作 雑作 畑作
ニューディール政策,昭和,アメリカのフランクリン・ローズヴェルト大統領が実施した経済回復政策は何ですか？,マーシャルプラン ケインズ政策 モンロー主義 トルーマン・ドクトリン ワグナー法 ブラント政策 ニューフロンティア マッカーシズム グリーンニューディール テネシー谷開発公社
人形浄瑠璃,江戸,三味線と語りに合わせて人形で演じる、日本の伝統芸能は何ですか？,歌舞伎 能 狂言 文楽 浄瑠璃 雅楽 謡曲 落語 太神楽 舞踏
奴婢,飛鳥〜平安,律令制度下で支配階級に所有されていた身分の低い人々を何と言いますか？,百姓 侍 農民 豪族 被官 奴隷 士族 武士 隠者 僧侶
年貢,奈良〜江戸,農民が土地の所有者や領主に納めた米や作物のことを何と言いますか？,賦役 地租 税金 租税 労役 御用 公役 御供 奉納 物納
年号,飛鳥,日本で特定の時代に名づけられた、天皇の在位中に使われる紀年法を何と言いますか？,西暦 元号 干支 暦注 節気 太陰暦 和暦 太陽暦 旧暦 天皇暦
年中行事,平安,日本の伝統的な暦に基づいて年間を通じて行われる行事を何と言いますか？,祭礼 祝祭 節句 仏事 伝統祭 旧暦祭 年祭 季節祭 行楽 例祭
能(能楽),室町,観阿弥・世阿弥父子によって大成された、日本の古典芸能は何ですか？,狂言 歌舞伎 浄瑠璃 文楽 雅楽 謡曲 舞楽 落語 舞踏 大道芸
農耕,縄文〜弥生,日本列島で稲作を中心とする農業が始まったことを何と言いますか？,狩猟採集 牧畜 遊牧 農業革命 畑作 園芸 稲作 蓄畜 耕作 栽培
農地改革,昭和,第二次世界大戦後、地主制度を解体し、自作農を増やすために行われた政策は何ですか？,土地解放 農地整理 農業改良 農業協同組合 農業振興 農村改革 農政改革 農村再生 農村振興政策 農業基盤整備
ノルマントン号事件,明治,1886年に起きた、イギリス船が日本人乗客を救助せず沈没し、治外法権撤廃運動のきっかけとなった事件は何ですか？,三国干渉事件 長崎事件 横浜事件 釜山事件 青島事件 日英紛争 上海事件 天津事件 広島事件 大阪事件
俳諧,江戸,滑稽や風刺を交えた和歌風の文芸で、松尾芭蕉などが活躍した文芸は何ですか？,連歌 和歌 短歌 狂歌 俳句 詩歌 物語 和讃 漢詩 詩文
配給制,昭和,戦時中や戦後の物資不足の際に実施された、生活必需品の分配制度を何と言いますか？,統制経済 価格統制 闇市 物資統制 戦時経済 食糧管理 物価統制 割当制度 共産主義経済 強制配給
俳句,江戸,五・七・五の十七音で構成され、季語を含む日本の短詩型文学は何ですか？,短歌 連歌 和歌 狂歌 俳諧 漢詩 詩歌 物語 和讃 詩文
廃藩置県,明治,1871年に行われた、藩を廃止し県を設置して中央集権化を進めた改革は何ですか？,版籍奉還 地租改正 明治維新 征韓論 廃仏毀釈 民選議院設立の建白 秩禄処分 戸籍法制定 徴兵令 民法公布
博多,鎌倉〜室町,鎌倉時代から室町時代にかけて対外貿易の中心となった九州の港町はどこですか？,長崎 下関 門司 鹿児島 佐賀 熊本 天草 平戸 五島 対馬
白村江の戦い,飛鳥,日本・百済連合軍が唐・新羅連合軍に敗れた663年の戦いは何ですか？,壬申の乱 応仁の乱 保元の乱 承久の乱 平治の乱 鳥羽・伏見の戦い 関ヶ原の戦い 壇ノ浦の戦い 壬生の戦い 長篠の戦い
幕藩体制,江戸,将軍と藩主がそれぞれ支配する政治体制を何と言いますか？,幕府政治 鎌倉幕府 南北朝時代 戦国時代 室町幕府 明治政府 藩政改革 武家政権 封建制度 領国政治
白鳳文化,飛鳥,天武・持統天皇の時代を中心に栄えた、仏教文化を特色とする文化は何ですか？,奈良文化 天平文化 平安文化 鎌倉文化 室町文化 江戸文化 飛鳥文化 元禄文化 大正文化 昭和文化
馬借,鎌倉〜室町,中世で物資の運搬を職業とした、馬を使った運送業者を何と言いますか？,問丸 車借 渡世人 傭兵 商人 鍛冶屋 木挽 網元 舟運業者 馬丁
旗本,江戸,将軍に直属し将軍に謁見できた、家禄1万石未満の武士のことを何と言いますか？,大名 御家人 浪人 侍大将 足軽 藩士 御用人 庄屋 村役人 郡代
バテレン追放令,安土桃山,1587年に豊臣秀吉がキリスト教の布教を禁じた法令は何ですか？,鎖国令 禁教令 島原・天草一揆 踏絵 キリシタン弾圧令 明暦の大火 天草の乱 廃仏毀釈令 五人組制度 兵農分離
埴輪,古墳,古墳の周囲に置かれた素焼きの土製人形を何と言いますか？,土偶 土面 土器 瓦当 鏡 銅鏡 土製品 石器 剣 甲冑
バブル経済,昭和,1980年代後半に日本で起きた、地価や株価が異常に高騰した経済状況を何と言いますか？,高度経済成長 オイルショック 昭和恐慌 大恐慌 経済バブル 円高不況 失われた10年 アベノミクス リーマンショック バブル景気
パリ講和会議,大正,第一次世界大戦後の講和条約を決定するために1919年に開かれた国際会議は何ですか？,ヴェルサイユ条約 国際連盟 ワシントン会議 サンフランシスコ会議 ヤルタ会議 ポツダム会議 ノイシュヴァンシュタイン城 ベルリン会議 バンドン会議 ケベック会議
ハル・ノート,昭和,太平洋戦争直前にアメリカが日本に提示した最後通牒を何と言いますか？,モンロー主義 カイロ宣言 ポツダム宣言 日米開戦 トルーマン・ドクトリン ワシントン海軍軍縮会議 国際連盟 マーシャル・プラン ヤルタ協定 ニューディール政策
藩,江戸,大名が治めた領地を何と言いますか？,領地 藩領 藩地 封土 領国 大名領 領分 封内 領土 領所
藩校,江戸,藩士の教育を目的として各藩が設置した学校を何と言いますか？,私塾 寺子屋 藩学 藩立学校 学問所 藩教育機関 学校 寺院 私塾制度 大学
万国博覧会(万博),近代〜現代,産業や文化を国際的に紹介・交流する目的で開催される展示会を何と言いますか？,国際博覧会 エキスポ 博覧会 国際展示会 万博会場 世界博覧会 国際博覧会連合 国際エキスポ ワールドフェア 展覧会
蛮社の獄,江戸,幕政を批判した渡辺崋山や高野長英らが処罰された事件を何と言いますか？,蛮社事件 幕府批判事件 思想弾圧 渡辺崋山事件 高野長英事件 江戸思想弾圧 蛮社弾圧 江戸弾圧 思想統制 弾圧事件
阪神・淡路大震災,現代,1995年に発生した兵庫県南部を中心とした大地震を何と言いますか？,兵庫県南部地震 神戸地震 阪神地震 淡路島地震 関西地震 1995地震 阪神震災 淡路震災 関西大震災 西日本大震災
藩政改革,江戸,各藩が財政難を打開するために行った政治・経済の改革を何と言いますか？,藩財政改革 財政改革 藩政治改革 藩経済改革 藩士改革 地方改革 藩政改善 藩財政再建 藩政再生 藩経済再建
版籍奉還,明治,1869年に大名が領地と領民を天皇に返上した政策を何と言いますか？,領地返還 版籍還付 藩返上 版籍還付令 領地返上 版籍返上 版籍納還 領土返還 政策改正 藩改正
班田収授法,奈良,戸籍に基づいて6歳以上の男女に口分田を支給し、一定期間後に返還させる制度を何と言いますか？,班田法 口分田法 収授法 口分田制度 戸籍制班田 口分田支給 班田制 班田制度 律令制口分田 口分田政策
藩閥,明治,明治政府で旧藩主や有力な武士が政治の中心を占めた体制を何と言いますか？,藩閥政治 旧藩閥 明治藩閥 政治家藩閥 政治的藩閥 藩閥支配 藩閥体制 藩閥政権 明治政権 政治体制
万里の長城,古代,中国の北方民族の侵入を防ぐために築かれた城壁を何と言いますか？,長城 万里長城 万里の城壁 中国の長城 北方城壁 長城壁 万里防壁 長城防衛壁 長城遺構 長城跡
比叡山,奈良〜平安,最澄が延暦寺を開き天台宗を広めた山はどこですか？,延暦寺 天台宗 比叡寺 比叡峰 比良山 伊吹山 鞍馬山 六甲山 鈴鹿山 丹波山
菱垣廻船,江戸,大阪と江戸間を定期的に運航した木綿などの輸送船は何ですか？,菱垣船 江戸菱垣船 回船 回船問屋 菱垣廻航船 菱垣廻航 菱垣廻 木綿輸送船 江戸回船 回航船
東インド会社,近世,アジアとの貿易を目的にオランダやイギリスが設立した貿易会社は何ですか？,三菱商会 大和商船 日本郵船 バルト海会社 ロシア貿易会社 西インド会社 東洋貿易会社 東インド洋会社 西インド洋会社 大インド会社
東日本大震災,現代,2011年に東北地方を中心に発生した大規模地震と津波災害は何ですか？,東北地方太平洋沖地震 福島大震災 東北大震災 東北地震津波 東日本津波地震 震災 東北津波 東日本震災 東北地方震災 宮城大震災
東廻り航路,江戸,日本海側と太平洋側を日本列島北部経由で結んだ航路を何と言いますか？,北廻り航路 北前航路 日本海航路 北廻航路 西回り回路 北廻り海道 東海道 北廻り海路 北回り航路 西回り航路
東山文化,室町,足利義政の時代に栄えた、簡素・優雅な美を重んじた文化は何ですか？,東山文化様式 東山様式 室町文化 足利文化 東山文化期 室町後期文化 東山美術 東山文化期文化 東山風 美術様式
飛脚,江戸,幕府や商人などのために書状や荷物を運んだ職業を何と言いますか？,飛脚業者 江戸飛脚 飛脚人 書状飛脚 飛脚便 飛脚配達人 飛脚屋 江戸配達人 書状配達人 書状便
肥前藩,江戸,佐賀藩とも呼ばれ、後に明治維新で重要な役割を果たした藩はどこですか？,佐賀藩領 佐賀県 佐賀藩主 佐賀藩地域 佐賀藩国 肥前地域 肥前藩主 藩領 佐賀国 肥前国
備中ぐわ,江戸,深く土を掘るのに使われた農具で、農業の発展に貢献した道具は何ですか？,備中鍬 農具 鍬 鋤 田鍬 鍬具 耕作用具 農耕具 農業用鍬 土農具
ひにん,江戸,身分制度で最下層に位置づけられた人々のうち、犯罪者などを指す呼称は何ですか？,非人身分 下層身分 被差別身分 犯罪者階級 被差別階級 賎民 犯罪者身分 江戸非人 被差別者 被差別階級者
日比谷焼き打ち事件,明治,1905年に日露戦争講和条約に反対する市民が起こした暴動は何ですか？,日比谷焼打ち事件 日比谷焼討ち事件 日比谷暴動 日比谷騒動 日比谷焼打事件 日比谷暴動事件 焼打ち事件 日比谷事件 日比谷騒擾 日比谷抗議
姫路城,安土桃山,日本の代表的な城郭建築で、白鷺城とも呼ばれる城は何ですか？,城郭建築 姫路の城 国宝城 世界遺産城 日本城郭 日本の城 姫路城天守 安土桃山城郭 城跡 城郭
百姓,奈良〜江戸,日本の農民や庶民を総称して何と言いますか？,農民 庶民 農家 農耕民 農民階級 農業従事者 農村住民 農夫 村人 住民
百姓一揆,江戸,江戸時代に農民が年貢軽減などを求めて起こした集団的抵抗運動は何ですか？,土一揆 農民一揆 百姓蜂起 農民蜂起 年貢一揆 農民反乱 年貢軽減運動 農民抵抗 国一揆 一向一揆
百姓代,江戸,百姓の意見を藩に伝える役職を何と言いますか？,村役人 村代 百姓頭 百姓代官 村代官 百姓役人 農民代表 農民代 百姓代表 農村代表
ピューリタン革命,近世,17世紀にイギリスで清教徒が起こした王政打倒の革命は何ですか？,市民革命 名誉革命 フランス革命 アメリカ独立戦争 グロリアーナ革命 マグナ・カルタ運動 共和制運動 清教徒戦争 権利章典闘争 ボストン茶会事件
氷河時代,先史,地球の気温が大幅に低下し、氷河が広がった時代を何と言いますか？,更新世 氷結期 極寒時代 古気候期 氷雪期 第四紀寒冷期 寒冷世 大寒期 原始寒冷期 地殻冷却期
平等院鳳凰堂,平安,宇治にある阿弥陀堂で、藤原頼通が建立した寺院は何ですか？,藤原文化 浄土式庭園 寝殿造 浄土信仰 阿弥陀堂建築 鳳凰信仰 阿弥陀如来信仰 藤原家寺院 浄土宗 貴族寺院
平泉,鎌倉,奥州藤原氏の拠点であり、中尊寺金色堂で知られる場所はどこですか？,中尊寺 藤原文化 北方政庁 奥州文化 浄土庭園 金色堂 奥州平定地 仏教都市 平安遺産 奥羽拠点
ひらがな,平安,日本語の音を表すために女性や貴族の間で生まれた表音文字は何ですか？,女文字 和字 万葉仮名 草仮名 仮名文字 やまと文字 流麗体 音表記文字 日本文字 和製文字
平戸,江戸,長崎県にある重要な貿易港で、オランダ商館も置かれた場所はどこですか？,出島 長崎 貿易港 西洋商館 鎖国拠点 対オランダ貿易 西洋接点 南蛮港 朱印船港 江戸外交港
ピラミッド,古代,ファラオの墓として建てられた巨大な石造建築物は何ですか？,古代建築 王墓 石造建築 エジプト文明 古代墳墓 王家の墓 神殿建築 巨石文明 陵墓建造物 太陽信仰建築
広島,現代,日本で1945年に原子爆弾が投下された都市はどこですか？,長崎 被爆地 原爆都市 太平洋戦争都市 終戦地 平和記念地 核兵器使用地 被災都市 戦争記憶地 悲劇の都市
琵琶法師,鎌倉,琵琶を弾きながら物語を語る旅芸人は何ですか？,語り部 平家物語伝承者 楽器芸人 中世芸能者 説話芸人 旅僧語り手 仏教語り手 弾語り芸人 語り芸人 音楽語り部
ヒンドゥー教,古代,多神教的要素を持ち、ヴェーダを経典とするインドの主要宗教は何ですか？,バラモン教 インド宗教 ヴェーダ教 インド哲学宗教 多神教 インド古代宗教 輪廻信仰 カルマ思想宗教 サンスクリット文化 アーリア系宗教
ファシスト党,昭和,ムッソリーニが率いたイタリアの極右政党は何ですか？,国家主義党 黒シャツ団 極右政党 反共政党 独裁主義党 独裁政党 イタリア独裁派 統制政治派 独裁主導党 軍国主義団体
ファシズム,昭和,国家の強化と独裁を重視し、全体主義的な政治体制を何と言いますか？,全体主義 独裁政治 国家主義 反民主主義 極右思想 軍国主義 抑圧政治 強権政治 権威主義 統制主義
フェートン号事件,江戸,1808年にイギリス軍艦が長崎港に侵入した事件を何と言いますか？,外国船事件 イギリス侵入事件 幕末危機 海外挑発事件 長崎事件 海防危機 異国船問題 鎖国動揺事件 港湾侵入事件 外交緊張事件
武家諸法度,江戸,将軍が大名を統制するために定めた法令を何と言いますか？,大名統制令 江戸幕府法 武士統制法 武家規律 幕府法度 大名律令 家臣規律法 封建規範 大名行動規範 統制令
武家政治,鎌倉〜江戸,武士が政権を握る政治体制を何と言いますか？,封建政治 将軍政治 武士政権 武士支配体制 幕府体制 軍事政治 士政 軍人政権 武断体制 武力支配体制
富国強兵,明治,近代国家建設のため、経済と軍備の充実を目指した政策は何ですか？,殖産興業 軍備拡張 国家強化策 近代化政策 国策強化 経済拡張 近代国家戦略 近代整備策 近代育成計画 防衛拡充政策
武士,平安〜江戸,主に武力をもって仕えた階級の人々を何と言いますか？,戦士 兵士 武力階級 武家 武装奉公人 武装階級 主従兵 軍人階級 封建武士 戦闘従属者
富士山,飛鳥〜現代,日本一高い山で、信仰の対象にもなった山は何ですか？,霊峰 日本最高峰 火山 霊山 巡礼地 名山 象徴山 修験山 国民的山岳 自然信仰地
武士団,平安,地方の武士たちが主従関係で構成した軍事集団を何と言いますか？,地方武装集団 軍団 武装集団 郡司武士団 武士連合 郷土軍団 在地武士団 士族組織 豪族軍団 戦力集団
武士道,鎌倉〜江戸,武士が理想とした倫理観・行動規範を何と言いますか？,忠義 名誉 戦士道徳 武人精神 封建倫理 戦士規律 忠誠思想 武人規範 自律精神 忠節道
藤原京,飛鳥,日本で最初の本格的な都城で、694年に遷都された都はどこですか？,都城制 古代首都 飛鳥京 初期都城 天皇都 都造営 奈良以前の都 朝廷首都 律令制首都 中央政庁
藤原氏,飛鳥〜平安,摂関政治を行い権勢をふるった貴族の氏族は何ですか？,貴族 摂関家 有力氏族 朝廷貴族 政権掌握氏族 上級公家 藤原北家 天皇家外戚 古代豪族 政治貴族
婦人参政権,昭和,1945年の選挙法改正で認められた女性の政治参加の権利は何ですか？,女性選挙権 女性の政治参加 女子選挙法改正 女性投票権 婦人権利拡張 女性参政改正 婦人立候補権 男女平等参政 戦後民主化改革 婦人運動成果
