アイスランド,ヨーロッパ,北大西洋に位置し火山活動が活発な国はどこですか？,フィンランド ノルウェー スウェーデン デンマーク アイルランド グリーンランド スコットランド エストニア ラトビア リトアニア
愛知県,中部,中京工業地帯の中心で、名古屋市がある県はどこですか？,三重県 岐阜県 滋賀県 静岡県 富山県 石川県 山梨県 和歌山県 長野県 福井県
青森県,東北,本州の最北端にある県はどこですか？,北海道 岩手県 秋田県 山形県 宮城県 福島県 栃木県 群馬県 茨城県 新潟県
青森市,東北,青森県の県庁所在地はどこですか？,弘前市 盛岡市 秋田市 仙台市 福島市 山形市 会津若松市 黒石市 八戸市 宇都宮市
赤石山脈,中部,南アルプスとも呼ばれる山脈は何ですか？,飛騨山脈 秩父山地 八ヶ岳 赤城山 谷川岳 奥秩父山塊 関東山地 丹沢山地 日光連山 奥羽山脈
明石市,近畿,日本の標準時子午線が通る都市はどこですか？,神戸市 姫路市 岡山市 和歌山市 高松市 徳島市 松山市 高知市 福山市 広島市
秋田県,東北,米の生産がさかんな東北地方の県はどこですか？,岩手県 宮城県 福島県 山形県 青森県 栃木県 群馬県 茨城県 新潟県 福井県
秋田市,東北,秋田県の県庁所在地はどこですか？,大仙市 横手市 能代市 盛岡市 仙台市 福島市 会津若松市 潟上市 青森市 宇都宮市
英虞湾,近畿,真珠の養殖がさかんな三重県の湾はどこですか？,志摩市 熊野市 尾鷲市 伊勢市 名張市 松阪市 鳥羽市 四日市市 鈴鹿市 津市
旭川市,北海道,北海道で札幌市に次いで人口が多い都市はどこですか？,函館市 釧路市 帯広市 北見市 室蘭市 稚内市 網走市 留萌市 江別市 小樽市
アフリカ,アフリカ,サハラ砂漠やナイル川がある州（大陸）はどこですか？,アジア ヨーロッパ 南極 北アメリカ 南アメリカ オセアニア 中東 カリブ海 地中海 マグリブ
アフリカ大陸,アフリカ,世界で2番目に大きい大陸はどこですか？,アジア ヨーロッパ 北アメリカ 南アメリカ オセアニア 南極 中東 カリブ海 地中海 マグリブ
アマゾン川,南アメリカ,南アメリカを流れる世界最大の流量をもつ川は何ですか？,ナイル川 ミシシッピ川 長江 ガンジス川 ドナウ川 コンゴ川 テムズ川 ライン川 ヴォルガ川 ユーフラテス川
アメリカ合衆国,北アメリカ,世界有数の経済大国で、州からなる国はどこですか？,カナダ メキシコ ブラジル アルゼンチン ロシア 中国 インド イギリス フランス ドイツ
アラスカ州,北アメリカ,アメリカの中で最も北にあり寒冷な州はどこですか？,カナダ グリーンランド アイスランド ノースダコタ モンタナ ミネソタ ウィスコンシン メーン バーモント ニューハンプシャー
アラビア半島,アジア,サウジアラビアなどが位置し、石油資源が豊富な半島はどこですか？,インドシナ半島 ユカタン半島 イベリア半島 アナトリア半島 バルカン半島 スカンディナヴィア半島 カムチャツカ半島 メキシコ半島 ラブラドル半島 ライン川流域
有明海,九州,九州の北西部にあり、海苔の養殖で知られる湾はどこですか？,八代海 瀬戸内海 豊後水道 宇和海 筑後川 河口湾 豊後灘 宇佐湾 五島灘 天草灘
アルゼンチン,南アメリカ,南アメリカ南部に位置し、パンパと呼ばれる草原が広がる国はどこですか？,ブラジル チリ ペルー コロンビア ベネズエラ ウルグアイ ボリビア エクアドル パラグアイ ガイアナ
アルプス山脈,ヨーロッパ,ヨーロッパ中部を東西に走る高い山脈は何ですか？,ピレネー山脈 カルパチア山脈 ウラル山脈 スカンディナヴィア山脈 グレートディバイディング山脈 ヒマラヤ山脈 アパラチア山脈 ロッキー山脈 アトラス山脈 コーカサス山脈
淡路島,近畿,瀬戸内海にあり、明石海峡大橋で本州とつながる島はどこですか？,四国 佐渡島 屋久島 小豆島 隠岐諸島 能登半島 対馬 丹後半島 隠岐島 五島列島
アンデス山脈,南アメリカ,南アメリカの西側に南北に長く伸びる山脈は何ですか？,ロッキー山脈 アパラチア山脈 ヒマラヤ山脈 ウラル山脈 グレートディバイディング山脈 ピレネー山脈 カルパチア山脈 アルプス山脈 コーカサス山脈 アトラス山脈
イギリス,ヨーロッパ,産業革命が始まったヨーロッパの島国はどこですか？,アイルランド アイスランド ノルウェー スウェーデン デンマーク オランダ ベルギー フランス ドイツ イタリア
石狩山地,北海道,北海道中央部に位置する山地は何ですか？,日高山脈 大雪山系 後志山地 十勝連峰 知床連山 トムラウシ山系 石狩平野 釧路平野 阿寒山地 根室半島
石狩平野,北海道,北海道で最も広く、農業が盛んな平野はどこですか？,十勝平野 函館平野 釧路平野 根室平野 後志平野 日高平野 札幌平野 網走平野 美唄平野 旭川平野
出雲大社,中国・四国,島根県にあり、古くから信仰を集めてきた神社は何ですか？,厳島神社 宮島神社 明治神宮 熱田神宮 伊勢神宮 鹿島神宮 香取神宮 日光東照宮 鹿苑寺 伏見稲荷大社
伊勢湾,中部,愛知県や三重県に面し、中京工業地帯に囲まれた湾はどこですか？,三河湾 駿河湾 琵琶湖 富士五湖 敦賀湾 若狭湾 東京湾 能登湾 大村湾 有明海
市川市,関東,千葉県にあり、江戸川沿いに発展した市はどこですか？,松戸市 柏市 浦安市 船橋市 市原市 鎌ヶ谷市 習志野市 我孫子市 流山市 八千代市
猪苗代湖,東北,福島県にある日本で4番目に大きい湖は何ですか？,霞ヶ浦 琵琶湖 阿寒湖 洞爺湖 十和田湖 支笏湖 田沢湖 宍道湖 諏訪湖 五色沼
茨城県,関東,水戸市を県庁所在地とし、農業と工業が盛んな関東地方の県はどこですか？,栃木県 群馬県 千葉県 埼玉県 東京都 神奈川県 長野県 山梨県 新潟県 福島県
茨木市,近畿,大阪府にあり、古くから交通の要所として栄えた市はどこですか？,吹田市 高槻市 東大阪市 堺市 豊中市 枚方市 八尾市 松原市 寝屋川市 大東市
今治市,中国・四国,しまなみ海道の起点で、タオルの生産がさかんな愛媛県の市はどこですか？,松山市 新居浜市 西条市 四国中央市 宇和島市 大洲市 八幡浜市 伊予市 西予市 東温市
イラン,アジア,中東にあり、ペルシャ湾に面し、石油資源が豊富な国はどこですか？,イラク サウジアラビア クウェート アラブ首長国連邦 カタール バーレーン オマーン ヨルダン レバノン シリア
いわき市,東北,福島県にあり、小名浜港やスパリゾートハワイアンズで知られる市はどこですか？,福島市 郡山市 会津若松市 白河市 喜多方市 相馬市 南相馬市 須賀川市 二本松市 田村市
岩国市,中国・四国,山口県にあり、錦帯橋で有名な市はどこですか？,下関市 周南市 防府市 山口市 宇部市 光市 長門市 萩市 柳井市 平生町
磐田原,中部,静岡県西部に広がる台地で、茶の栽培が盛んな場所はどこですか？,掛川市 袋井市 浜松市 湖西市 藤枝市 焼津市 御前崎市 静岡市 沼津市 富士市
岩手県,東北,本州で最も面積が広く、盛岡市を県庁所在地とする県はどこですか？,青森県 秋田県 宮城県 山形県 福島県 栃木県 群馬県 茨城県 新潟県 長野県
石見銀山,中国・四国,島根県にある、世界遺産に登録された歴史的な銀山はどこですか？,足尾銅山 阿蘇山 佐渡金山 菱刈鉱山 銀山町 室蘭市 岩手銀山 出雲大社 富士山 屋久島
インダス川,アジア,パキスタンを流れ、古代文明が栄えた川は何ですか？,ガンジス川 ブラマプトラ川 メコン川 イラワジ川 ヤンツェ川 黄河 ラプラ川 チグリス川 ユーフラテス川 ナイル川
インド,アジア,南アジアに位置し、人口が世界最多の国はどこですか？,中国 バングラデシュ パキスタン ネパール スリランカ ブータン モルディブ アフガニスタン タイ ミャンマー
インドネシア,アジア,多くの島からなる東南アジアの国で、ジャワ島があるのはどこですか？,フィリピン マレーシア タイ ベトナム シンガポール ミャンマー ラオス カンボジア 東ティモール ブルネイ
インド洋,世界,アジア・アフリカ・オーストラリアに囲まれた海洋は何ですか？,太平洋 大西洋 北極海 南極海 地中海 カリブ海 バルト海 日本海 ベーリング海 ノルウェー海
上野村,関東,群馬県南西部で神流川上流に位置し人口が少ない村はどこですか？,神流町 下仁田町 甘楽町 藤岡市 高崎市 前橋市 桐生市 伊勢崎市 太田市 沼田市
有珠山,北海道,北海道の洞爺湖の南岸にあり20世紀に複数回噴火した活火山は何ですか？,昭和新山 十勝岳 羊蹄山 樽前山 駒ヶ岳 利尻山 然別湖 恵山 山中湖 大雪山系
宇部市,中国・四国,山口県西部にあり石炭から化学工業へ発展した工業都市はどこですか？,下関市 周南市 防府市 山口市 萩市 岩国市 光市 柳井市 長門市 山陽小野田市
ウユニ塩原,南アメリカ,ボリビア南西部にある世界最大級の塩湖はどこですか？,ティティカカ湖 マラカイボ湖 チチカカ湖 セルバンテス湖 ポリマ湖 ペルー湖 カラカス湖 ブラジル湖 アマゾン湖 リオデジャネイロ湖
ウラル山脈,ヨーロッパ,ヨーロッパとアジアの境界とされるロシアの長大な山脈は何ですか？,コーカサス山脈 アルタイ山脈 アパラチア山脈 カルパチア山脈 ピレネー山脈 スカンディナビア山脈 アルプス山脈 ロッキー山脈 ヒマラヤ山脈 アトラス山脈
雲仙岳(普賢岳),九州,1990年代の火砕流で知られる長崎県島原半島の活火山は何ですか？,阿蘇山 桜島 霧島山 口永良部島 富士山 桑折山 薩摩富士 霧島連山 鬼界カルデラ 宮崎山地
エクアドル,南アメリカ,国名が「赤道」を意味しガラパゴス諸島を領有する南米の国はどこですか？,コロンビア ペルー ボリビア チリ ベネズエラ ガイアナ スリナム フランス領ギアナ アルゼンチン ウルグアイ
エジプト,アフリカ,ナイル川流域に古代文明が栄え今もピラミッドが残る国はどこですか？,スーダン リビア チャド ニジェール ナイジェリア エチオピア ケニア ウガンダ タンザニア モロッコ
エチオピア高原,アフリカ,「アフリカの屋根」と呼ばれ標高2000ｍを超える東アフリカの高原はどこですか？,ケニア高原 タンザニア高原 ウガンダ高原 ルワンダ高原 ブルンジ高原 マダガスカル高原 ザンビア高原 ジンバブエ高原 モザンビーク高原 南アフリカ高原
越後山脈,中部,新潟県と福島県の県境に連なる山脈は何ですか？,飯豊山脈 会津山地 尾瀬山地 赤城山 谷川岳 越中山脈 飛騨山脈 上越山脈 八ヶ岳 丹沢山地
越後平野,中部,信濃川と阿賀野川の下流に広がる新潟県最大の平野はどこですか？,長岡平野 新発田平野 会津平野 阿賀野平野 福島平野 上越平野 越前平野 佐渡平野 富山平野 石川平野
択捉島,北海道,北方領土の中で最も大きい島はどこですか？,国後島 色丹島 歯舞群島 紋別島 礼文島 利尻島 奥尻島 天売島 焼尻島 苫小牧島
愛媛県,日本,松山市を県庁所在地としみかんの生産がさかんな四国の県はどこですか？,高知県 徳島県 香川県 福岡県 大分県 佐賀県 長崎県 熊本県 宮崎県 鹿児島県
奥羽山脈,東北,東北地方を南北に貫く本州最長の山脈は何ですか？,出羽山地 陸奥山地 霊山 阿武隈山地 磐梯山 越前山脈 飯豊山脈 丹沢山地 越後山脈 八ヶ岳
大泉町,関東,ブラジル出身者が多く「リトルブラジル」とも呼ばれる群馬県の町はどこですか？,高崎市 前橋市 桐生市 伊勢崎市 太田市 藤岡市 沼田市 甘楽町 みどり市 安中市
大分県,九州,別府温泉や由布院温泉が有名な九州の県はどこですか？,熊本県 宮崎県 鹿児島県 佐賀県 長崎県 福岡県 大牟田市 延岡市 日南市 日向市
大阪市,近畿,淀川河口部に発展し関西の経済中心となっている政令指定都市はどこですか？,神戸市 京都市 堺市 奈良市 和歌山市 豊中市 吹田市 茨木市 東大阪市 枚方市
大阪平野,近畿,淀川が形成し大阪府中央部から兵庫県南東部に広がる平野はどこですか？,京都盆地 河内平野 堺平野 奈良盆地 淀川流域 大和高原 六甲山地 生駒山地 和泉山地 箕面山地
小笠原諸島,関東,東京都に属し「東洋のガラパゴス」と呼ばれる亜熱帯の離島群はどこですか？,伊豆諸島 南鳥島 琉球諸島 八丈島 大島 三宅島 父島 母島 奄美群島 硫黄島
岡山県,中国・四国,桃の生産がさかんで、吉備団子の発祥地として知られる中国地方の県はどこですか？,広島県 山口県 鳥取県 島根県 愛媛県 香川県 徳島県 高知県 福岡県 佐賀県
岡山市,中国・四国,岡山県の県庁所在地で、晴れの日が多い都市はどこですか？,広島市 山口市 松山市 高松市 高知市 徳島市 鳥取市 島根市 米子市 倉敷市
沖縄県,九州,本州から最も南に位置し、サンゴ礁や観光で有名な県はどこですか？,鹿児島県 宮崎県 長崎県 佐賀県 福岡県 大分県 熊本県 山口県 愛媛県 高知県
沖ノ鳥島,九州,日本の最南端にある小さな島で、排他的経済水域を確保するために重要な島はどこですか？,南鳥島 小笠原諸島 与那国島 石垣島 宮古島 久米島 奄美大島 渡嘉敷島 渡名喜島 久高島
奥多摩,関東,東京都の西端にある山間地域で、多摩川の源流域として知られる場所はどこですか？,丹沢山地 秩父山地 奥秩父山地 奥武蔵山地 高尾山地 八王子市 青梅市 日の出町 瑞穂町 羽村市
オーストラリア,オセアニア,首都をキャンベラにもち、羊毛や鉱産資源の輸出が多い国はどこですか？,ニュージーランド パプアニューギニア フィジー サモア トンガ バヌアツ ソロモン諸島 フランス領ポリネシア クック諸島 ナウル
オーストラリア大陸,オセアニア,世界で最も小さく、全体が一つの国である大陸はどこですか？,南極大陸 南アメリカ大陸 アフリカ大陸 ユーラシア大陸 北アメリカ大陸 南極 オセアニア大陸 アジア大陸 北極圏 グリーンランド
尾瀬,関東,群馬・福島・新潟にまたがる湿原で、高山植物の宝庫として知られる国立公園はどこですか？,日光 磐梯山 草津白根 八甲田 那須 赤城 谷川連峰 男体山 奥只見 谷川岳
オセアニア州,オセアニア,オーストラリアやニュージーランド、南太平洋の島々を含む州はどこですか？,アジア州 ヨーロッパ州 アフリカ州 北アメリカ州 南アメリカ州 南極州 オセドニア州 カリブ州 太平洋州 アジア太平洋州
小樽市,北海道,北海道の日本海側に位置し、運河と歴史的建物で観光地となっている市はどこですか？,函館市 旭川市 釧路市 帯広市 北見市 室蘭市 網走市 根室市 留萌市 稚内市
尾道市,中国・四国,広島県にあるしまなみ海道の起点で、坂の町として知られる市はどこですか？,福山市 三原市 呉市 廿日市市 広島市 東広島市 安芸高田市 大竹市 海田町 府中町
オホーツク海,世界,北海道の北東に広がる海で、冬に流氷が見られるのはどこですか？,日本海 太平洋 北海道湾 ベーリング海 北極海 北海道沖瀬戸内海 瀬戸内海 サハリン海 カムチャッカ海 南シナ海
オランダ,ヨーロッパ,干拓地の利用が進み、風車とチューリップで有名なヨーロッパの国はどこですか？,ベルギー デンマーク ドイツ フランス スウェーデン ノルウェー イギリス アイルランド ポーランド チェコ
香川県,中国・四国,うどんの産地として有名で、日本で最も面積が小さい県はどこですか？,徳島県 愛媛県 高知県 福岡県 佐賀県 長崎県 大分県 熊本県 宮崎県 鹿児島県
鹿児島県,九州,桜島を有し、さつまいもや茶の生産がさかんな九州の県はどこですか？,宮崎県 熊本県 大分県 福岡県 佐賀県 長崎県 沖縄県 兵庫県 宮城県 山口県
鹿児島市,九州,鹿児島県の県庁所在地で、桜島に面した都市はどこですか？,熊本市 宮崎市 福岡市 佐賀市 長崎市 大分市 鹿児市 鹿島市 宮古市 石垣市
笠野原,九州,鹿児島県南西部にある火山灰からなる台地で、サツマイモなどの栽培が行われる場所はどこですか？,霧島台地 阿蘇台地 宮崎台地 鹿児島平野 九州中央台地 日向台地 薩摩台地 肝属台地 那須台地 天草台地
カザフスタン,アジア,中央アジアに位置し、かつてソ連に属していた内陸国はどこですか？,ウズベキスタン トルクメニスタン キルギス タジキスタン モンゴル アフガニスタン イラン イラク サウジアラビア クウェート
門真市,近畿,大阪府にあり、家電メーカーの本社が立地している市はどこですか？,東大阪市 大東市 枚方市 寝屋川市 茨木市 高槻市 豊中市 吹田市 箕面市 池田市
ガーナ,アフリカ,西アフリカに位置し、カカオ豆の生産がさかんな国はどこですか？,コートジボワール ナイジェリア セネガル マリ ガンビア ベナン トーゴ フィリピン リベリア シエラレオネ
神奈川県,関東,横浜市や川崎市を含み、人口が日本で2番目に多い県はどこですか？,東京都 埼玉県 千葉県 茨城県 栃木県 群馬県 山梨県 長野県 新潟県 福島県
金沢市,中部,加賀百万石の城下町として栄え、伝統工芸が盛んな石川県の市はどこですか？,富山市 高岡市 福井市 敦賀市 小松市 七尾市 輪島市 羽咋市 白山市 野々市市
カナダ,北アメリカ,面積がロシアに次いで世界第2位で、森林資源が豊富な国はどこですか？,アメリカ合衆国 メキシコ ブラジル アルゼンチン 中国 インド オーストラリア フランス ドイツ イギリス
鎌倉市,関東,神奈川県にあり、かつて幕府が置かれた歴史的都市はどこですか？,横浜市 川崎市 藤沢市 茅ヶ崎市 相模原市 平塚市 大和市 海老名市 座間市 綾瀬市
神山町,中国・四国,徳島県にあるIT企業のサテライトオフィス誘致で有名になった町はどこですか？,美馬市 阿波市 三好市 板野町 名西郡 丹波町 美馬町 吉野川市 小松島市 徳島市
樺太(サハリン),アジア,かつて日本領であり、現在はロシア領になっている島はどこですか？,千島列島 北海道 本州 四国 九州 南鳥島 小笠原諸島 南極大陸 ニューギニア島 ニュージーランド
カリブ海諸国,北アメリカ,中米にある多くの島国で、観光やサトウキビ栽培がさかんな地域はどこですか？,バハマ諸島 バミューダ諸島 バルバドス セントルシア グレナダ トリニダード・トバゴ ジャマイカ ドミニカ国 ハイチ ドミニカ共和国
軽井沢町,中部,長野県にある避暑地・別荘地として有名な町はどこですか？,白馬村 諏訪市 松本市 飯田市 伊那市 長野市 上田市 小諸市 佐久市 安曇野市
川崎市,関東,神奈川県にある工業地帯が広がる政令指定都市はどこですか？,横浜市 相模原市 さいたま市 千葉市 川口市 船橋市 所沢市 藤沢市 厚木市 茅ヶ崎市
韓国,アジア,朝鮮半島の南部に位置し、ソウルを首都とする国はどこですか？,北朝鮮 中国 日本 モンゴル 台湾 フィリピン ベトナム タイ カンボジア ラオス
ガンジス川,アジア,ヒンドゥー教の聖なる川とされ、インド北部を流れる川は何ですか？,インダス川 ヤムナ川 ブラマプトラ川 メコン川 サルウィン川 ナイル川 アマゾン川 ミシシッピ川 ドナウ川 テムズ川
関東山地,関東,関東地方西部に広がり、秩父山地などを含む山地は何ですか？,奥武蔵山地 丹沢山地 奥秩父山地 筑波山地 飯能山地 多摩山地 北関東山地 大秩父山地 日光山地 足尾山地
関東平野,関東,日本最大の平野で、東京や埼玉などを含む広大な平野はどこですか？,濃尾平野 北九州平野 筑紫平野 琵琶湖平野 信濃平野 上毛平野 江戸平野 山形平野 福島平野 日光平野
カンボジア,アジア,東南アジアにあり、アンコールワット遺跡で有名な国はどこですか？,タイ ラオス ベトナム ミャンマー マレーシア シンガポール インドネシア フィリピン ブルネイ 東ティモール
ギアナ高地,南アメリカ,南アメリカ北部にあり、テーブルマウンテンが特徴的な高地はどこですか？,アンデス山脈 パンパ 高原 アマゾン盆地 グアテマラ高地 グアヤキル高地 アタカマ高地 マラカイボ盆地 グアラニー高地 マヤ高地
紀伊山地,近畿,奈良・和歌山・三重県にまたがる山地で、高野山や吉野山があるのはどこですか？,丹波山地 中国山地 六甲山地 比良山地 播磨山地 山陰山地 近畿山地 筑波山地 奥羽山脈 日光山地
紀伊半島,近畿,本州南部に突き出し、熊野古道などがある半島はどこですか？,能登半島 房総半島 知多半島 三浦半島 若狭半島 尾鷲半島 佐渡半島 淡路島 近畿半島 四国
木曽川,中部,長野県に源をもち、濃尾平野を流れる中部地方の川は何ですか？,信濃川 天竜川 富士川 球磨川 利根川 阿賀野川 吉野川 濃尾川 北上川 最上川
木曽山脈,中部,中央アルプスとも呼ばれる長野県の山脈は何ですか？,南アルプス 飛騨山脈 北アルプス 越後山脈 赤石山脈 奥羽山脈 日光山脈 筑波山地 関東山地 丹沢山地
北アメリカ州,北アメリカ,アメリカ合衆国やカナダ、メキシコなどを含む州（大陸）はどこですか？,南アメリカ州 ヨーロッパ州 アジア州 アフリカ州 オセアニア州 南極州 北極圏 中東地域 カリブ海地域 太平洋地域
北アメリカ大陸,北アメリカ,五大湖やロッキー山脈をもつ大陸はどこですか？,南アメリカ大陸 ユーラシア大陸 アフリカ大陸 オーストラリア大陸 南極大陸 北極圏 グリーンランド インドネシア フィリピン ジャワ島
北上高地,東北,岩手県の東部に広がるなだらかな高地はどこですか？,奥羽山脈 陸中山地 出羽山地 奥羽山地 秋田平野 岩手平野 仙台平野 盛岡平野 北上平野 仙台丘陵
北上市,東北,岩手県の中部に位置し、北上川沿いにある市はどこですか？,盛岡市 花巻市 一関市 久慈市 宮古市 大船渡市 釜石市 遠野市 二戸市 奥州市
北九州市,九州,福岡県にあり、八幡製鉄所がつくられた工業都市はどこですか？,福岡市 久留米市 大牟田市 柳川市 筑後市 直方市 飯塚市 宮若市 八女市 大川市
北朝鮮,アジア,朝鮮半島の北半分を占め、ピョンヤンを首都とする国はどこですか？,韓国 中国 ロシア モンゴル 日本 ベトナム タイ ラオス カンボジア ミャンマー
北ドイツ平原,ヨーロッパ,ヨーロッパ北部に広がる、氷河の影響でできた平坦な地形の平原はどこですか？,ポーランド平原 フランス平原 イギリス平原 イタリア平原 スペイン平原 ベルギー平原 オランダ平原 ドイツ中部高地 バルト三国 ラトビア
北見盆地,北海道,北海道東部にあり、玉ねぎの生産がさかんな盆地はどこですか？,十勝盆地 釧路平野 美幌盆地 帯広盆地 網走平野 石狩盆地 津別盆地 長沼平野 美瑛盆地 斜里盆地
